{
  "fixture": "incheon_gimpo_2026-10-08",
  "contract_version": "2026-10-09.1",
  "stage": "a",
  "source": {
    "report": "docs/source/incheon_gimpo_report.md",
    "sections": [
      "§12-4-3 통합 종합 점수표",
      "§12-4-4 통합 TOP 5",
      "§12-4-2 통합 rerank(#124)",
      "§6-3·§6-5 인천 8후보",
      "§12-5-2 상황별 decide(#125~129)"
    ],
    "report_asof": "2026-10-07",
    "fixture_asof": "2026-10-08",
    "note": "보고서 기준일은 2026-10-07, RA §9 회귀 픽스처 기준일은 2026-10-08(같은 데이터)."
  },
  "weights": {
    "p10": 0.35,
    "rerank": 0.2,
    "gap": 0.15,
    "benchmark": 0.1,
    "supply": 0.1,
    "liquidity": 0.1
  },
  "tie_rule": {
    "epsilon": 0.05,
    "compare_on": "raw",
    "grouping": "leader",
    "rank_method": "competition",
    "decide_tie_confidence": 0.6,
    "description": "total 내림차순(동률이면 complex_id 오름차순) 정렬 후, 그룹 리더와의 차이가 0.05 미만인 뒤따르는 단지를 같은 그룹으로 묶는다(반올림 전 원값, 10진 연산). 그룹은 같은 rank(경쟁 순위 1,2,2,4)이고 2개 이상일 때만 tie_group 번호(1부터). decide confidence < 0.6이면 확률 상위 2개 tie=true·chosen=true."
  },
  "tolerance": 0.01,
  "complexes": [
    {
      "key": "granter",
      "complex_id": 1,
      "name": "더샵 송도그란테르",
      "area": "인천 송도",
      "judge_scope": "판정 대상",
      "intake_note": "마감·추가 미정",
      "components": {
        "p10": 3.9,
        "rerank": 8.9,
        "gap": 5.5,
        "benchmark": 5.0,
        "supply": 7.0,
        "liquidity": 7.0
      },
      "raw": {
        "p10_prob": 0.39,
        "rerank_relevance": 0.89,
        "rerank_relevance_incheon8": 0.89
      },
      "report_total": 5.87,
      "report_rank": 1,
      "computed_total": 5.87,
      "expected_rank": 1,
      "tie_group": null,
      "component_notes": {
        "gap": "±5% → 5.5",
        "benchmark": "IBD +12~82% / 9억대 −18~+9% → 5",
        "supply": "IBD 추가 공급 없음 → 7",
        "liquidity": "전매 6개월·거주의무 없음, 대출 6억 한도 → 7"
      }
    },
    {
      "key": "elif",
      "complex_id": 2,
      "name": "엘리프 검단 포레듀",
      "area": "인천 검단",
      "judge_scope": "판정 대상",
      "intake_note": "선착순 가능",
      "components": {
        "p10": 4.5,
        "rerank": 8.9,
        "gap": 6.3,
        "benchmark": 5.0,
        "supply": 3.0,
        "liquidity": 6.0
      },
      "raw": {
        "p10_prob": 0.45,
        "rerank_relevance": 0.89,
        "rerank_relevance_incheon8": 0.91
      },
      "report_total": 5.7,
      "report_rank": 2,
      "computed_total": 5.7,
      "expected_rank": 2,
      "tie_group": null,
      "component_notes": {
        "gap": "혼재(−30~+20) → 6.3",
        "benchmark": "검단 저가분 +54~103% / 2023~24 −1~+10% → 5",
        "supply": "2028 동시 입주 → 3",
        "liquidity": "전매 3년(2028-09)·거주의무 없음 → 6"
      }
    },
    {
      "key": "hannaedeul",
      "complex_id": 3,
      "name": "송도 한내들 센트럴리버",
      "area": "인천 송도",
      "judge_scope": "판정 대상",
      "intake_note": "선착순 가능",
      "components": {
        "p10": 3.1,
        "rerank": 8.9,
        "gap": 4.4,
        "benchmark": 4.0,
        "supply": 5.0,
        "liquidity": 9.0
      },
      "raw": {
        "p10_prob": 0.31,
        "rerank_relevance": 0.89,
        "rerank_relevance_incheon8": 0.9
      },
      "report_total": 5.33,
      "report_rank": 3,
      "computed_total": 5.325,
      "expected_rank": 3,
      "tie_group": null,
      "component_notes": {
        "gap": "−5~+10% → 4.4",
        "benchmark": "11공구 분양권 ±8% / 9억대 −18~+9% → 4",
        "supply": "2029~30 11공구 대기 물량 → 5",
        "liquidity": "전매 도과·거주의무 없음 → 9"
      }
    },
    {
      "key": "switzen",
      "complex_id": 4,
      "name": "오퍼스 한강 스위첸",
      "area": "김포",
      "judge_scope": "판정 대상",
      "intake_note": "선착순(비공식) 확인 불가",
      "components": {
        "p10": 3.3,
        "rerank": 8.7,
        "gap": 5.0,
        "benchmark": 4.5,
        "supply": 3.0,
        "liquidity": 6.0
      },
      "raw": {
        "p10_prob": 0.33,
        "rerank_relevance": 0.87,
        "rerank_relevance_incheon8": null
      },
      "report_total": 5.0,
      "report_rank": 4,
      "computed_total": 4.995,
      "expected_rank": 4,
      "tie_group": null,
      "component_notes": {
        "gap": "리버시티 +0~+20 / 센트럴자이 −10~−20 → 혼재 중앙 0 → 5.0",
        "benchmark": "리버시티 +45~63 / 고촌센트럴자이 −2~+3 → 4.5",
        "supply": "2028 김포 8,860 동시 입주(본 단지 포함) → 3",
        "liquidity": "전매 3년(2028-07, 등기 시 해제)·거주의무 없음 → 6"
      }
    },
    {
      "key": "centreville_educity",
      "complex_id": 5,
      "name": "검단 센트레빌 에듀시티",
      "area": "인천 검단",
      "judge_scope": "판정 대상",
      "intake_note": "선착순(비공식) 미정",
      "components": {
        "p10": 2.6,
        "rerank": 8.3,
        "gap": 4.6,
        "benchmark": 4.5,
        "supply": 3.0,
        "liquidity": 6.0
      },
      "raw": {
        "p10_prob": 0.26,
        "rerank_relevance": 0.83,
        "rerank_relevance_incheon8": 0.83
      },
      "report_total": 4.61,
      "report_rank": 5,
      "computed_total": 4.61,
      "expected_rank": 5,
      "tie_group": 1,
      "component_notes": {
        "gap": "−5~+8% → 4.6",
        "benchmark": "당하동 +54~63% / 2023~24 −1~+10% → 4.5",
        "supply": "2028 동시 입주 → 3",
        "liquidity": "전매 3년(2028-10)·거주의무 없음 → 6"
      }
    },
    {
      "key": "thesharp_ab23",
      "complex_id": 6,
      "name": "더샵 검단레이크파크 AB23",
      "area": "인천 검단",
      "judge_scope": "판정 대상",
      "intake_note": "미정(마감임박)",
      "components": {
        "p10": 2.9,
        "rerank": 7.7,
        "gap": 7.0,
        "benchmark": 5.0,
        "supply": 3.0,
        "liquidity": 2.0
      },
      "raw": {
        "p10_prob": 0.29,
        "rerank_relevance": 0.77,
        "rerank_relevance_incheon8": 0.77
      },
      "report_total": 4.61,
      "report_rank": 5,
      "computed_total": 4.605,
      "expected_rank": 5,
      "tie_group": 1,
      "component_notes": {
        "gap": "−20~−27% / +3~8% → 7.0",
        "benchmark": "검단 → 5",
        "supply": "2029-12 2,857 동시 입주 → 3",
        "liquidity": "전매 3년(2029-07)·거주의무 3년 → 2"
      }
    },
    {
      "key": "cantavil",
      "complex_id": 7,
      "name": "김포 칸타빌 에디션",
      "area": "김포",
      "judge_scope": "판정 대상",
      "intake_note": "선착순 가능(공식 확인)",
      "components": {
        "p10": 2.9,
        "rerank": 7.3,
        "gap": 3.1,
        "benchmark": 4.0,
        "supply": 2.5,
        "liquidity": 9.0
      },
      "raw": {
        "p10_prob": 0.29,
        "rerank_relevance": 0.73,
        "rerank_relevance_incheon8": null
      },
      "report_total": 4.49,
      "report_rank": 7,
      "computed_total": 4.49,
      "expected_rank": 7,
      "tie_group": null,
      "component_notes": {
        "gap": "걸포 메트로자이(2020) +0~+15 → 중앙 +7.5 → 3.1",
        "benchmark": "메트로자이 +31~70 / 우미린 분양권 −12~−26 → 4",
        "supply": "2028 8,860(북변 오브센트 3,058 포함)+북변5 대기 → 2.5",
        "liquidity": "전매 도과·거주의무·재당첨 없음·계약금 5% → 9"
      }
    },
    {
      "key": "gracent2",
      "complex_id": 8,
      "name": "풍무역세권 수자인 그라센트 2차",
      "area": "김포",
      "judge_scope": "판정 대상",
      "intake_note": "미정(4차 미확인)",
      "components": {
        "p10": 2.7,
        "rerank": 8.3,
        "gap": 3.75,
        "benchmark": 5.0,
        "supply": 2.0,
        "liquidity": 5.0
      },
      "raw": {
        "p10_prob": 0.27,
        "rerank_relevance": 0.83,
        "rerank_relevance_incheon8": null
      },
      "report_total": 4.37,
      "report_rank": 8,
      "computed_total": 4.3675,
      "expected_rank": 8,
      "tie_group": null,
      "component_notes": {
        "gap": "풍무 센트럴 푸르지오 −8~−15 / 사우 아이파크 +10~+25(둘 다 2018 대체) → 중앙 +5 → 3.75",
        "benchmark": "풍무 센트럴 푸르지오 +95~110(2015, 추정) / 2023 이후 사례 없음 → 5",
        "supply": "풍무역세권 자체 2028~30 5,811 연속 입주 → 2",
        "liquidity": "전매 3년(2029-04)·거주의무 없음·중도금 이자 대납 → 5"
      }
    },
    {
      "key": "riverfront",
      "complex_id": 9,
      "name": "한강 푸르지오 리버프론트",
      "area": "김포",
      "judge_scope": "판정 대상",
      "intake_note": "미정(선착순 추정)",
      "components": {
        "p10": 2.8,
        "rerank": 7.5,
        "gap": 2.4,
        "benchmark": 4.5,
        "supply": 2.5,
        "liquidity": 4.0
      },
      "raw": {
        "p10_prob": 0.28,
        "rerank_relevance": 0.75,
        "rerank_relevance_incheon8": null
      },
      "report_total": 3.94,
      "report_rank": 9,
      "computed_total": 3.94,
      "expected_rank": 9,
      "tie_group": 2,
      "component_notes": {
        "gap": "리버시티 +11~+33 / 센트럴자이 −12~0 → 중앙 +10.5 → 2.4",
        "benchmark": "4.5",
        "supply": "2028 8,860 + 2031 본 단지 2,432 단일 대량 → 2.5",
        "liquidity": "전매 3년(2029-08)·입주 2031까지 차익 실현 불가 → 4"
      }
    },
    {
      "key": "lottecastle",
      "complex_id": 10,
      "name": "풍무역 롯데캐슬 시그니처",
      "area": "김포",
      "judge_scope": "판정 대상",
      "intake_note": "미정(4차 없음)",
      "components": {
        "p10": 1.7,
        "rerank": 5.9,
        "gap": 3.5,
        "benchmark": 5.0,
        "supply": 2.0,
        "liquidity": 9.0
      },
      "raw": {
        "p10_prob": 0.17,
        "rerank_relevance": 0.59,
        "rerank_relevance_incheon8": null
      },
      "report_total": 3.9,
      "report_rank": 10,
      "computed_total": 3.9,
      "expected_rank": 9,
      "tie_group": 2,
      "component_notes": {
        "gap": "풍무 센트럴 푸르지오(2018 대체) +2~+10 → 중앙 +6 → 3.5",
        "benchmark": "5",
        "supply": "풍무·사우 2028 4,773 + 2029~30 3,331 → 2",
        "liquidity": "전매 도과·거주의무 없음 → 9"
      }
    },
    {
      "key": "gochon_centralxi",
      "complex_id": 11,
      "name": "고촌센트럴자이",
      "area": "김포",
      "judge_scope": "판정 대상",
      "intake_note": "미정(14차 미확인), 즉시 입주",
      "components": {
        "p10": 1.1,
        "rerank": 5.3,
        "gap": 5.0,
        "benchmark": 3.0,
        "supply": 5.0,
        "liquidity": 9.0
      },
      "raw": {
        "p10_prob": 0.11,
        "rerank_relevance": 0.53,
        "rerank_relevance_incheon8": null
      },
      "report_total": 3.9,
      "report_rank": 10,